{
  "_comment": "Baseline for bin/bare-catch-ratchet.mjs. Keys are <file>::<named-scope-chain> — LINE-FREE by house rule. Never hand-edit; use --seed / --tighten / --accept.",
  "version": 1,
  "keys": {
    "admin/auth.mjs::saveStore": 1,
    "admin/lib/core.mjs::readJSON": 1,
    "admin/lib/core.mjs::readTxt": 1,
    "admin/lib/core.mjs::registry": 1,
    "admin/lib/core.mjs::reportsFor": 1,
    "admin/routes/a11y.mjs::latestA11y": 2,
    "admin/routes/annotations.mjs::handle><arrow>": 1,
    "admin/routes/codeql-remediation.mjs::<arrow>": 4,
    "admin/routes/codeql-remediation.mjs::applyJob>rollback": 1,
    "admin/routes/codeql-remediation.mjs::runClaude><arrow>><arrow>": 1,
    "admin/routes/codeql-remediation.mjs::runClaude><arrow>>killTree": 2,
    "admin/routes/codeql-remediation.mjs::runLocal": 2,
    "admin/routes/codeql-remediation.mjs::runPipeline": 1,
    "admin/routes/codeql-remediation.mjs::sourceContext": 1,
    "admin/routes/cra.mjs::handle": 1,
    "admin/routes/cra.mjs::handle><arrow>": 1,
    "admin/routes/host.mjs::hostAttributed": 2,
    "admin/routes/host.mjs::hostAttributed>isDir": 1,
    "admin/routes/issue-detail.mjs::handle><arrow>": 1,
    "admin/routes/packages.mjs::handle": 1,
    "admin/routes/projects-view.mjs::addProject": 1,
    "admin/routes/remediation-policy.mjs::handle><arrow>><arrow>": 1,
    "admin/routes/remediation.mjs::handoffIssuesSection": 1,
    "admin/routes/remediation.mjs::launchClaudeSession": 1,
    "admin/routes/remediation.mjs::llmTargets>probe": 1,
    "admin/routes/remediation.mjs::runLocalModel": 3,
    "admin/routes/secrets.mjs::demandedBy": 2,
    "admin/routes/verdicts.mjs::handle": 2,
    "admin/rp-origin.mjs::declaredHosts": 1,
    "admin/rp-origin.mjs::rpFor": 1,
    "admin/serve.mjs::<arrow>": 2,
    "admin/serve.mjs::codeStamp": 1,
    "admin/serve.mjs::codeStamp>scan": 2,
    "admin/serve.mjs::csrfOk": 1,
    "admin/serve.mjs::csrfOk><arrow>": 1,
    "admin/serve.mjs::feed": 1,
    "admin/serve.mjs::fileFresh": 1,
    "admin/serve.mjs::handleRequest": 2,
    "admin/serve.mjs::knownProjects": 1,
    "admin/serve.mjs::needsBootstrapQuiet": 1,
    "admin/serve.mjs::nucleiTally": 1,
    "admin/serve.mjs::onRequest": 1,
    "admin/serve.mjs::proxy": 1,
    "admin/serve.mjs::proxy><arrow>": 1,
    "admin/serve.mjs::publish": 1,
    "admin/serve.mjs::readJSON": 1,
    "admin/serve.mjs::readJsonBody><arrow>": 1,
    "admin/serve.mjs::readTxt": 1,
    "admin/serve.mjs::reportsFor": 1,
    "admin/serve.mjs::restartPanel": 1,
    "admin/serve.mjs::restartPanel>relaunch": 1,
    "admin/serve.mjs::safeStrEq": 1,
    "admin/serve.mjs::stopJob>signal": 1,
    "admin/serve.mjs::trigger": 1,
    "bin/a11y-scan.mjs::htmlFiles>walk": 1,
    "bin/addsecret.mjs::projectFromCwd": 1,
    "bin/adjudicate-gates.mjs::loadGate": 1,
    "bin/adjudicate-gates.mjs::measureAt": 1,
    "bin/agent-tag.mjs::roster": 1,
    "bin/anchor-staleness.mjs::gitShow": 1,
    "bin/anchor-staleness.mjs::main": 1,
    "bin/anchor-staleness.mjs::readNow": 1,
    "bin/audit.mjs::findReportFile": 1,
    "bin/audit.mjs::handleNuclei": 2,
    "bin/audit.mjs::handleSarif": 2,
    "bin/audit.mjs::main>walkExts": 1,
    "bin/audit.mjs::safeJSON": 1,
    "bin/audit.mjs::treeHasMatch": 1,
    "bin/authz-bola.mjs::discover": 1,
    "bin/bola-run.mjs::<arrow>": 1,
    "bin/bola-run.mjs::autodiscover": 1,
    "bin/bola-run.mjs::disclosesObject": 1,
    "bin/bola-run.mjs::keycloak": 1,
    "bin/bola-run.mjs::listBundled": 1,
    "bin/bola-run.mjs::resolveObjects": 1,
    "bin/bola-run.mjs::subjectOf": 1,
    "bin/bola-run.mjs::supabase": 1,
    "bin/build-health.mjs::deadcode": 1,
    "bin/build-health.mjs::have": 1,
    "bin/build-health.mjs::listFiles>walk": 1,
    "bin/build-health.mjs::node": 1,
    "bin/build-health.mjs::provenance": 1,
    "bin/build-health.mjs::read": 1,
    "bin/build-health.mjs::toolchain": 1,
    "bin/canary-harness.mjs::claimScenarios>run": 1,
    "bin/canary-harness.mjs::realDriftedOpen": 1,
    "bin/canary-harness.mjs::run": 5,
    "bin/canary-harness.mjs::run><arrow>": 2,
    "bin/canary-harness.mjs::runGate": 1,
    "bin/canary-harness.mjs::runGate><arrow>": 1,
    "bin/close-gate.mjs::worklist": 1,
    "bin/commitwork.mjs::laneCoverage": 1,
    "bin/commitwork.mjs::listBundled": 1,
    "bin/commitwork.mjs::parseReport": 6,
    "bin/commitwork.mjs::parseReport><arrow>": 4,
    "bin/commitwork.mjs::safeReadJSON": 1,
    "bin/commitwork.mjs::treeHasFile": 1,
    "bin/commitwork.mjs::writeChecksStatus": 1,
    "bin/deploy.mjs::canonical": 1,
    "bin/deps-content.mjs::<module>": 2,
    "bin/docs-doctor.mjs::loadCache": 1,
    "bin/docs-doctor.mjs::saveCache": 1,
    "bin/eval-delta.mjs::loadArtifact": 1,
    "bin/focus-journal.mjs::readFocusState": 1,
    "bin/gate-ratchet.mjs::<arrow>": 1,
    "bin/gate-ratchet.mjs::anchorReport": 1,
    "bin/gate-ratchet.mjs::attribute": 1,
    "bin/gate-ratchet.mjs::dirtyDrifted": 1,
    "bin/gate-ratchet.mjs::measure": 1,
    "bin/gate-ratchet.mjs::readStdinSession": 2,
    "bin/gate-ratchet.mjs::whoTouched": 1,
    "bin/gate-ratchet.mjs::whoTouched>committedAt": 1,
    "bin/gate-ratchet.mjs::whoTouched>readLedger": 1,
    "bin/gate-spine.mjs::<module>": 2,
    "bin/gate-spine.mjs::readLedger": 2,
    "bin/gate-spine.mjs::readStdinSession": 1,
    "bin/gate-spine.mjs::readTaskStatuses": 1,
    "bin/gate-tests-core.mjs::attributeFiles": 1,
    "bin/gate-tests.mjs::attribute>read": 1,
    "bin/gate-tests.mjs::git": 1,
    "bin/gate-tests.mjs::pruneStaleHeadWorktrees": 1,
    "bin/gate-tests.mjs::readStdinSession": 2,
    "bin/gate-tests.mjs::sessionLabels": 1,
    "bin/gate-tests.mjs::suiteAtHead": 1,
    "bin/guard-jackson-caseinsensitive.mjs::walk": 3,
    "bin/head-sha.mjs::headSha": 1,
    "bin/hook-once.mjs::decideEmit": 3,
    "bin/hook-once.mjs::forget": 2,
    "bin/hook-once.mjs::readRecord": 1,
    "bin/hook-once.mjs::shouldEmit": 2,
    "bin/issue-llm.mjs::extractVerdict": 1,
    "bin/issue-llm.mjs::findingKeyFor": 1,
    "bin/issue-llm.mjs::loadCalibration": 1,
    "bin/issue-loop.mjs::cwdForRepo": 1,
    "bin/issue.mjs::repoPathMap": 1,
    "bin/lib/verdict-journal-core.mjs::anchorDataStore": 1,
    "bin/lib/verdict-journal-core.mjs::appendLocked": 1,
    "bin/lib/verdict-journal-core.mjs::readJournalFile": 1,
    "bin/lib/verdict-journal-core.mjs::verifyDataAnchors": 1,
    "bin/memory-layer-migrate-tenant.mjs::<module>": 2,
    "bin/memory-layer-migrate-tenant.mjs::api": 1,
    "bin/minify-detect.mjs::parseWasm": 1,
    "bin/minify-detect.mjs::readCapped": 2,
    "bin/minify-detect.mjs::sourcemapInfo": 1,
    "bin/minify-detect.mjs::walk": 1,
    "bin/panel-breakglass.mjs::storeFacts": 1,
    "bin/parse-renovate.mjs::<module>": 1,
    "bin/parse-runtime.mjs::nucleiRecords": 2,
    "bin/parse-runtime.mjs::parseAuthz": 1,
    "bin/parse-runtime.mjs::parseNuclei": 1,
    "bin/parse-runtime.mjs::parseProbes": 1,
    "bin/pin-actions.mjs::lsRemoteTags": 1,
    "bin/projectstatus.mjs::git": 1,
    "bin/projectstatus.mjs::readJson": 1,
    "bin/quality-gates.mjs::<arrow>": 1,
    "bin/quality-gates.mjs::<module>": 5,
    "bin/quality-gates.mjs::findFiles": 1,
    "bin/quality-gates.mjs::read": 1,
    "bin/races.mjs::<arrow>": 1,
    "bin/races.mjs::safeJSON": 1,
    "bin/rate-llm.mjs::extractJSON": 1,
    "bin/rate-llm.mjs::main": 1,
    "bin/resolve-sha.mjs::<module>": 1,
    "bin/resolve-sha.mjs::inHead": 1,
    "bin/resolve-sha.mjs::isCommit": 1,
    "bin/resolve-sha.mjs::rebuild": 1,
    "bin/session-title.mjs::sessions": 4,
    "bin/setup.mjs::runSetup>ask": 1,
    "bin/spine-ledger.mjs::<module>": 1,
    "bin/spine-ledger.mjs::main": 5,
    "bin/spine-ledger.mjs::main>unwrap": 2,
    "bin/stub-detect.mjs::walk": 3,
    "bin/tls-headers-scan.mjs::tls": 2,
    "bin/tls-headers-scan.mjs::tlsTargets": 3,
    "bin/touch-ledger.mjs::<module>": 3,
    "bin/vendor-scan.mjs::findVendored>walk": 1,
    "bin/vendor-scan.mjs::scan": 1,
    "bin/vendor-verify.mjs::resolvePackage": 1,
    "bin/verdict-flow.mjs::census": 4,
    "bin/verdict-journal.mjs::<module>": 1,
    "bin/verify-branch-protection.mjs::ghApi": 1,
    "bin/yarn-audit.mjs::main>addDeps": 1,
    "cra/attest.mjs::canonicalDigest": 1,
    "cra/attest.mjs::cmdKeygen": 1,
    "cra/attest.mjs::cmdSign": 1,
    "cra/controls.mjs::ranChecksFromSweep": 1,
    "cra/lib.mjs::latestSweepDir": 1,
    "cra/lib.mjs::listSubdirNames": 1,
    "cra/refresh.mjs::<module>": 1,
    "cra/refresh.mjs::walk": 2,
    "cra/runtime.mjs::<module>": 1,
    "cra/runtime.mjs::runtimeStatus": 1,
    "lib/deploy-core.mjs::probeUnauthenticated><arrow>": 1,
    "lib/mail.mjs::resendTransport": 2,
    "lib/memory-layer-client.mjs::call": 1,
    "lib/memory-layer-client.mjs::safeUrl": 1,
    "lib/secrets.mjs::saveTable": 1,
    "map/build-data.mjs::deriveHistories": 1,
    "map/render.mjs::<module>": 1,
    "mcp/server.mjs::<arrow>": 1,
    "mcp/server.mjs::bundledManifests": 1,
    "mcp/server.mjs::handler": 1,
    "mcp/server.mjs::listResources>walk": 1,
    "monitor/area.mjs::sweepBatches": 1,
    "monitor/area.mjs::sweepBatches><arrow>": 2,
    "monitor/artifact-anomaly.mjs::artifactFindingCount": 3,
    "monitor/artifact-anomaly.mjs::collectSamples": 2,
    "monitor/artifact-anomaly.mjs::discoverRepoDirs": 2,
    "monitor/artifact-anomaly.mjs::isDir": 1,
    "monitor/backfill-dimensions.mjs::<module>": 6,
    "monitor/backfill-dimensions.mjs::mdTable": 1,
    "monitor/backfill-dimensions.mjs::tallyTrivyDir": 2,
    "monitor/backfill-docs.mjs::<module>": 3,
    "monitor/backfill-docs.mjs::parseNpm": 1,
    "monitor/backfill-docs.mjs::parseOsv": 1,
    "monitor/codeql-fleet-data.mjs::<arrow>": 1,
    "monitor/codeql-fleet-data.mjs::<module>": 2,
    "monitor/codeql-fleet-data.mjs::repoDirs": 1,
    "monitor/codeql-fleet-data.mjs::repoDirs><arrow>": 1,
    "monitor/compact-reports.mjs::<module>": 4,
    "monitor/compact-reports.mjs::batchArea": 1,
    "monitor/compact-reports.mjs::bytesOf>walk": 2,